{
  "schema_version": "2.0.0",
  "provider_job_id": "provider-job-association-001",
  "association_run_id": "association-run-001",
  "evidence_set_id": "evidence-set-001",
  "bank_snapshot_id": "bank-snapshot-001",
  "status": "COMPLETED",
  "decisions": [
    {
      "tracklet_id": "tracklet-001",
      "group_key": "current-group-001",
      "action": "CREATE_NEW_GID",
      "selected_person_cluster_id": null,
      "new_gid_group_key": "new:left:current-group-001",
      "selected_roster_entry_id": null,
      "confidence": 0.61,
      "candidates": [
        {
          "candidate_key": "candidate-001",
          "person_cluster_id": "person-cluster-001",
          "roster_entry_id": "roster-entry-011",
          "rank": 1,
          "confidence": 0.61,
          "scores": [
            {
              "component": "DINO",
              "value": 0.82,
              "model_namespace": "dinov2/vits14-reg/v1"
            }
          ]
        }
      ],
      "rationale": "existing candidates were not reliable enough; create an active unbound GID"
    }
  ],
  "content_sha256": "9999999999999999999999999999999999999999999999999999999999999999"
}
